{
  "moduleId": 7,
  "version": 1,
  "fields": {
    "73": {
      "pipeline-overview": {
        "pardavimai": "Data: topic [X] (sales)\nDo: list 10 possible sales data sources (e.g. CRM, ERP, e-commerce)\nFormat: 1) source 2) type 3) what it gives 4) how to access",
        "rinkodara": "Data: topic [X] (marketing)\nDo: list 10 possible marketing data sources (e.g. campaigns, social, web analytics)\nFormat: 1) source 2) type 3) what it gives 4) how to access",
        "it-inzinerija": "Data: topic [X] (pipeline)\nDo: list 10 possible pipeline data sources (e.g. DB, API, logs, files)\nFormat: 1) source 2) type 3) what it gives 4) how to access",
        "personalas": "Data: topic [X] (HR)\nDo: list 10 possible HR data sources (e.g. HRIS, surveys, hiring portals)\nFormat: 1) source 2) type 3) what it gives 4) how to access",
        "vadyba": "Data: topic [X] (business KPI)\nDo: list 10 possible business KPI data sources (e.g. KPIs, finance, operations)\nFormat: 1) source 2) type 3) what it gives 4) how to access",
        "kita": "Data: topic [X] ([X])\nDo: list 10 possible [X] data sources (e.g. [X] sources)\nFormat: 1) source 2) type 3) what it gives 4) how to access"
      },
      "pipeline-prep": {
        "pardavimai": "Data: [paste sales table]\nDo: find missing values and suggest fill methods\nFormat: 1) column 2) % missing 3) method 4) risk if not fixed",
        "rinkodara": "Data: [paste marketing / campaign table]\nDo: find missing values and suggest fill methods\nFormat: 1) column 2) % missing 3) method 4) risk if not fixed",
        "it-inzinerija": "Data: [paste pipeline / quality table]\nDo: find missing values and suggest fill methods\nFormat: 1) column 2) % missing 3) method 4) risk if not fixed",
        "personalas": "Data: [paste HR table]\nDo: find missing values and suggest fill methods\nFormat: 1) column 2) % missing 3) method 4) risk if not fixed",
        "vadyba": "Data: [paste executive KPI table]\nDo: find missing values and suggest fill methods\nFormat: 1) column 2) % missing 3) method 4) risk if not fixed",
        "kita": "Data: [paste [X] table]\nDo: find missing values and suggest fill methods\nFormat: 1) column 2) % missing 3) method 4) risk if not fixed"
      },
      "pipeline-eda": {
        "pardavimai": "Data: [paste sales data]\nDo: identify 5 most important patterns\nFormat: 1) pattern 2) evidence in numbers 3) business meaning",
        "rinkodara": "Data: [paste marketing / campaign data]\nDo: identify 5 most important patterns\nFormat: 1) pattern 2) evidence in numbers 3) business meaning",
        "it-inzinerija": "Data: [paste pipeline / quality data]\nDo: identify 5 most important patterns\nFormat: 1) pattern 2) evidence in numbers 3) business meaning",
        "personalas": "Data: [paste HR data]\nDo: identify 5 most important patterns\nFormat: 1) pattern 2) evidence in numbers 3) business meaning",
        "vadyba": "Data: [paste executive KPI data]\nDo: identify 5 most important patterns\nFormat: 1) pattern 2) evidence in numbers 3) business meaning",
        "kita": "Data: [paste [X] data]\nDo: identify 5 most important patterns\nFormat: 1) pattern 2) evidence in numbers 3) business meaning"
      },
      "pipeline-model": {
        "pardavimai": "Data: [paste sales data]\nDo: suggest 1–2 calculation / forecast methods for this topic\nFormat: 1) method 2) which columns 3) assumptions 4) what a human should check",
        "rinkodara": "Data: [paste marketing / campaign data]\nDo: suggest 1–2 calculation / forecast methods for this topic\nFormat: 1) method 2) which columns 3) assumptions 4) what a human should check",
        "it-inzinerija": "Data: [paste pipeline / quality data]\nDo: suggest 1–2 calculation / forecast methods for this topic\nFormat: 1) method 2) which columns 3) assumptions 4) what a human should check",
        "personalas": "Data: [paste HR data]\nDo: suggest 1–2 calculation / forecast methods for this topic\nFormat: 1) method 2) which columns 3) assumptions 4) what a human should check",
        "vadyba": "Data: [paste executive KPI data]\nDo: suggest 1–2 calculation / forecast methods for this topic\nFormat: 1) method 2) which columns 3) assumptions 4) what a human should check",
        "kita": "Data: [paste [X] data]\nDo: suggest 1–2 calculation / forecast methods for this topic\nFormat: 1) method 2) which columns 3) assumptions 4) what a human should check"
      },
      "pipeline-viz": {
        "pardavimai": "Data: [paste sales data]\nDo: suggest 3 charts for this analysis\nFormat: 1) chart type 2) axes / dimensions 3) insight",
        "rinkodara": "Data: [paste marketing / campaign data]\nDo: suggest 3 charts for this analysis\nFormat: 1) chart type 2) axes / dimensions 3) insight",
        "it-inzinerija": "Data: [paste pipeline / quality data]\nDo: suggest 3 charts for this analysis\nFormat: 1) chart type 2) axes / dimensions 3) insight",
        "personalas": "Data: [paste HR data]\nDo: suggest 3 charts for this analysis\nFormat: 1) chart type 2) axes / dimensions 3) insight",
        "vadyba": "Data: [paste executive KPI data]\nDo: suggest 3 charts for this analysis\nFormat: 1) chart type 2) axes / dimensions 3) insight",
        "kita": "Data: [paste [X] data]\nDo: suggest 3 charts for this analysis\nFormat: 1) chart type 2) axes / dimensions 3) insight"
      },
      "pipeline-publish": {
        "pardavimai": "Data: [paste sales insights or table]\nDo: generate an executive report with recommendations\nFormat: 1) summary 2) 3 insights 3) 3 actions 4) risks",
        "rinkodara": "Data: [paste marketing / campaign insights or table]\nDo: generate an executive report with recommendations\nFormat: 1) summary 2) 3 insights 3) 3 actions 4) risks",
        "it-inzinerija": "Data: [paste pipeline / quality insights or table]\nDo: generate an executive report with recommendations\nFormat: 1) summary 2) 3 insights 3) 3 actions 4) risks",
        "personalas": "Data: [paste HR insights or table]\nDo: generate an executive report with recommendations\nFormat: 1) summary 2) 3 insights 3) 3 actions 4) risks",
        "vadyba": "Data: [paste executive KPI insights or table]\nDo: generate an executive report with recommendations\nFormat: 1) summary 2) 3 insights 3) 3 actions 4) risks",
        "kita": "Data: [paste [X] insights or table]\nDo: generate an executive report with recommendations\nFormat: 1) summary 2) 3 insights 3) 3 actions 4) risks"
      }
    },
    "74": {
      "master-prompt": {
        "pardavimai": "META: You are an experienced data analyst (sales). Goal: full sales analysis on topic [X].\n\nINPUT: Topic – [X]. Data: [paste or describe sources: CRM, ERP, e-commerce]. If data is missing – write “I don’t know” and say what is missing; do not guess.\n\nOUTPUT: Provide 8 blocks:\n1. Data sources (CRM, ERP, e-commerce)\n2. Data structure\n3. Cleaning\n4. EDA (top products, regions, trends)\n5. Visualization suggestions\n6. Insights\n7. Forecasts (Q4, inventory)\n8. Strategic recommendations",
        "rinkodara": "META: You are an experienced market analyst (marketing). Goal: full marketing analysis on topic [X].\n\nINPUT: Topic – [X]. Data: [paste or describe sources: campaigns, social, web analytics]. If data is missing – write “I don’t know” and say what is missing; do not guess.\n\nOUTPUT: Provide 8 blocks:\n1. Data sources (campaigns, social, web analytics)\n2. Data structure\n3. Cleaning\n4. EDA (channels, content, sentiment)\n5. Visualization suggestions\n6. Insights\n7. Forecasts (reach, conversion)\n8. Strategic recommendations",
        "it-inzinerija": "META: You are an experienced data engineer (IT). Goal: full data systems analysis on topic [X].\n\nINPUT: Topic – [X]. Data: [paste or describe sources: DB, API, logs, files]. If data is missing – write “I don’t know” and say what is missing; do not guess.\n\nOUTPUT: Provide 8 blocks:\n1. Data sources (DB, API, logs, files)\n2. Data structure\n3. Cleaning\n4. EDA (volume, errors, latency)\n5. Visualization suggestions\n6. Insights\n7. Forecasts (load, ETL)\n8. Automation recommendations",
        "personalas": "META: You are an experienced HR analyst. Goal: full people / workforce analysis on topic [X].\n\nINPUT: Topic – [X]. Data: [paste or describe sources: HRIS, surveys, hiring portals]. If data is missing – write “I don’t know” and say what is missing; do not guess.\n\nOUTPUT: Provide 8 blocks:\n1. Data sources (HRIS, surveys, hiring portals)\n2. Data structure\n3. Cleaning\n4. EDA (hiring, attrition, retention)\n5. Visualization suggestions\n6. Insights\n7. Forecasts (headcount, risk)\n8. Strategic recommendations",
        "vadyba": "META: You are an experienced strategic business analyst. Goal: full business analysis on topic [X].\n\nINPUT: Topic – [X]. Data: [paste or describe sources: KPIs, finance, operations]. If data is missing – write “I don’t know” and say what is missing; do not guess.\n\nOUTPUT: Provide 8 blocks:\n1. Data sources (KPIs, finance, operations)\n2. Data structure\n3. Cleaning\n4. EDA (metrics, trends, risks)\n5. Visualization suggestions\n6. Insights\n7. Forecasts (scenarios)\n8. Decision recommendations",
        "kita": "META: You are an experienced data analyst. Goal: full [X] analysis on topic [X].\n\nINPUT: Topic – [X]. Data: [paste or describe sources: [X] sources]. If data is missing – write “I don’t know” and say what is missing; do not guess.\n\nOUTPUT: Provide 8 blocks:\n1. Data sources ([X] sources)\n2. Data structure\n3. Cleaning\n4. EDA (key patterns)\n5. Visualization suggestions\n6. Insights\n7. Forecasts ([X] trend)\n8. Strategic recommendations"
      }
    },
    "75": {
      "reflection": {